{
  "$schema": "https://json-schema.org/draft/2020-12/schema",
  "$id": "https://open-support-agent.dev/schemas/core/capability-manifest.json",
  "title": "CapabilityManifest",
  "description": "What an OSAS implementation actually supports (introduced in v0.1.1; part of specVersion \"0.2\"). Served at GET /.well-known/osas and GET /v1/capabilities; operations needing an undeclared capability fail with CAPABILITY_UNSUPPORTED.",
  "type": "object",
  "additionalProperties": false,
  "required": [
    "specVersion",
    "implementationId",
    "implementationVersion",
    "profiles",
    "transports",
    "executionModes",
    "adapterVersion"
  ],
  "properties": {
    "specVersion": { "$ref": "./common.json#/$defs/SpecVersion" },
    "implementationId": { "type": "string", "minLength": 1 },
    "implementationVersion": { "type": "string", "minLength": 1 },
    "profiles": {
      "type": "array",
      "minItems": 1,
      "items": {
        "type": "object",
        "additionalProperties": false,
        "required": ["name", "capabilities"],
        "properties": {
          "name": { "type": "string", "enum": ["core", "ecommerce", "saas"] },
          "capabilities": {
            "type": "array",
            "items": { "$ref": "#/$defs/Capability" },
            "uniqueItems": true
          }
        }
      }
    },
    "transports": {
      "type": "array",
      "minItems": 1,
      "items": { "type": "string", "enum": ["http", "mcp"] },
      "uniqueItems": true
    },
    "executionModes": {
      "type": "array",
      "minItems": 1,
      "items": { "type": "string", "enum": ["proposal_only", "shadow", "sandbox", "live"] },
      "uniqueItems": true
    },
    "adapterVersion": { "type": "string", "minLength": 1 },
    "executionContracts": {
      "type": "array",
      "items": {
        "type": "object",
        "additionalProperties": false,
        "required": [
          "actionType",
          "supportedModes",
          "approvalRequired",
          "supportsIdempotency",
          "supportsReconciliation",
          "supportsCompensation"
        ],
        "properties": {
          "actionType": { "type": "string", "minLength": 1 },
          "supportedModes": {
            "type": "array",
            "items": { "enum": ["proposal_only", "shadow", "sandbox", "live"] },
            "uniqueItems": true
          },
          "approvalRequired": { "type": "boolean" },
          "supportsIdempotency": { "type": "boolean" },
          "supportsReconciliation": { "type": "boolean" },
          "supportsCompensation": { "type": "boolean" }
        }
      }
    }
  },
  "$defs": {
    "Capability": {
      "type": "string",
      "enum": [
        "case.read",
        "customer.read",
        "knowledge.read",
        "evidence.read",
        "note.write",
        "escalation.write",
        "proposal.write",
        "approval.read",
        "approval.decide",
        "audit.read",
        "ecommerce.order.read",
        "ecommerce.shipment.read",
        "ecommerce.refund.propose",
        "ecommerce.refund.execute",
        "ecommerce.shipment_incident.read",
        "ecommerce.refund_status.read",
        "ecommerce.item_claim.propose",
        "ecommerce.exchange.propose",
        "saas.subscription.read",
        "saas.credit.propose"
      ]
    }
  }
}
